{
  "schema_version": 2,
  "generated_at": "2026-08-10T19:55:20Z",
  "receipt_id": "M-176",
  "receipt_result": "PASS — 1/1 declared command",
  "passed_commands": 1,
  "declared_commands": 1,
  "timestamps": {
    "started_at": "2026-07-16T22:32:31.633Z",
    "finished_at": "2026-07-16T22:32:44.944Z"
  },
  "commands": [
    {
      "cmd": "./node_modules/.bin/ava test/constructor.test.js",
      "exit_code": 0,
      "timed_out": false,
      "duration_ms": 1388
    }
  ],
  "environment": {
    "container_image_ref": "node@sha256:40ad9f3064e67d6860b4bc3fe1880b2953934fd6320ada990e45fe0efa6badd7",
    "container_image_digest": "node@sha256:40ad9f3064e67d6860b4bc3fe1880b2953934fd6320ada990e45fe0efa6badd7",
    "container_image_id": "sha256:6ed6ff875e9714bb845b850b08f3ad231ccbb5848812647bcf11acdd4bd1d2f8",
    "container_os": "linux",
    "container_architecture": "arm64",
    "network_policy": "phaseA:bridge,phaseB:none",
    "workspace_mode": null,
    "workspace_write_allowlist": [],
    "workspace_file_count_limit": null,
    "workspace_bytes_limit": null,
    "initial_workspace_manifest_digest": null,
    "post_run_changed_tracked_paths": [],
    "post_run_untracked_paths": [],
    "post_run_mode_changes": [],
    "source_commit": "64182013ac77df26d96dce3ba49a008015a9a600",
    "install_commands": [
      "npm ci"
    ]
  },
  "code": {
    "base_commit": "64182013ac77df26d96dce3ba49a008015a9a600",
    "recorded_patch_commit": "dad4d74f7c11eb20d8783d43caa4b29b850bd320",
    "patch_commit_binding": "declared metadata; not execution-bound",
    "patch_diff_hash": "sha256:c94ba3d9a8d05706f251446af82c90bf1ec3c46b18a16a7fe88c70797b460b05",
    "patch_diff_binding": "bound to executed patch bytes"
  },
  "execution_summary": "1/1 declared command returned exit 0 in the recorded environment",
  "bundle": {
    "bundle_contents_digest": "sha256:4336cf789521039384d0a61c7ad4b6a3b8c644aa503a3d564a40ae5eace87f5a",
    "signed_asset_sha256": "sha256:f208b5838773e12407f556a788daa48194216ead0217f4dcef0cb8b76c6a1380",
    "attestation_uri": "https://github.com/northset-oss/verification-pilot/releases/download/run-record-M-176-4336cf789521/run-record-M-176-4336cf789521.tar.gz",
    "attestation_verified_at": "2026-07-16T22:49:26.547Z",
    "provenance": "Signed provenance recorded; the signer records artifact origin, not execution witnessing or maintainer approval."
  },
  "classification": "CONTRIBUTOR SELF-RUN — NOT MAINTAINER VERIFICATION",
  "links": {
    "canonical_url": "https://northset-oss.github.io/verification-pilot/receipts/M-176/",
    "target_repo": "https://github.com/gr2m/github-project",
    "issue_or_task": "https://github.com/gr2m/github-project/issues/22",
    "publication_pr": "https://github.com/gr2m/github-project/pull/186"
  },
  "issue_title": "Throw helpful error when `number` option is invalid",
  "limitations": [
    "Does not prove code quality",
    "Does not prove security",
    "Contributor self-run record of Northset's own contribution; not the maintainer's verification.",
    "The receipt proves the focused constructor regression only; maintainer review, CI, and merge remain independent decisions."
  ],
  "correction": null,
  "scope_note": "The receipt proves the focused constructor regression only; maintainer review, CI, and merge remain independent decisions.",
  "upstream_outcome": {
    "status": "open",
    "link": "https://github.com/gr2m/github-project/pull/186",
    "attribution": "Live upstream pull request"
  },
  "economic_identity": {
    "scope": "end_to_end_task",
    "task": {
      "task_id": "TASK-OSS-AFF06F41E4AFA0E0",
      "attempt_id": "M-176",
      "attempt_sequence": 2,
      "work_category": "defect_fix",
      "external_demand": {
        "source": "public_github_issue",
        "issue_url": "https://github.com/gr2m/github-project/issues/22",
        "acceptance_contract_digest": "sha256:f5e3904d5c6e47c2ccf3c04ead4b3b8dce33786b78d97e699be1e90e5b4692e0",
        "invitation_type": "label",
        "invitation_url": "https://github.com/gr2m/github-project/issues/22"
      }
    },
    "funding": {
      "program": "Northset OSS Fund",
      "initiative": "OSS mission experimentation",
      "budget_id": null,
      "financial_cap": null,
      "currency": null
    },
    "external_transfers": {
      "maintainer_payment": "none",
      "merge_contingent": false
    },
    "authorization": {
      "approved_manifest_digest": "sha256:02ac19c59436efba6518eb51b2383bb9cf1406ecd91df5dc7bedf7069467a54d",
      "approved_by": "internal-user:aeziz",
      "approved_at": "2026-07-16T22:34:04.736Z",
      "operational_caps": {
        "finder_wall_seconds": 1200,
        "qualification_wall_seconds": 300,
        "prepare_wall_seconds": 3600,
        "ship_wall_seconds": 3600,
        "maximum_attempts": null
      }
    },
    "attempt_lineage": {
      "attempts_total": 2,
      "successful_attempt_id": "M-176",
      "attempts": [
        {
          "attempt_id": "M-175",
          "attempt_sequence": 1,
          "state": "FAILED_INFRA_TERMINAL",
          "terminal_reason_class": "infrastructure"
        },
        {
          "attempt_id": "M-176",
          "attempt_sequence": 2,
          "state": "READY",
          "terminal_reason_class": null
        }
      ]
    },
    "usage": {
      "discovery": {
        "finder_run_id": null,
        "candidate_rank": null,
        "elapsed_ms": null
      },
      "qualification": {
        "review_id": "sha256:4216f0932268ad51c96a0b076d79c71e90e38882e7a357c44e5f2803e75c581d",
        "requested_model": "gpt-5.6-sol",
        "actual_model": null,
        "reasoning_effort": "xhigh",
        "service_tier": "fast",
        "duration_ms": 172572,
        "model_requests": null,
        "input_tokens": null,
        "cached_input_tokens": null,
        "output_tokens": null,
        "reasoning_tokens": null
      },
      "authoring": {
        "requested_model": "gpt-5.6-sol",
        "actual_model": null,
        "reasoning_effort": "xhigh",
        "service_tier": "fast",
        "duration_ms": 66785,
        "bootstrap_duration_ms": 8857,
        "bootstrap_retry_count": 0,
        "model_requests": null,
        "input_tokens": null,
        "cached_input_tokens": null,
        "output_tokens": null,
        "reasoning_tokens": null
      },
      "preparation": {
        "total_duration_ms": 93135,
        "stages": [
          {
            "stage": "prepare_recheck",
            "duration_ms": 5617
          },
          {
            "stage": "executor_image",
            "duration_ms": 31
          },
          {
            "stage": "clone",
            "duration_ms": 724
          },
          {
            "stage": "author",
            "duration_ms": 79910
          },
          {
            "stage": "canonical_commit",
            "duration_ms": 362
          },
          {
            "stage": "differential_oracle",
            "duration_ms": 6491
          }
        ]
      },
      "verification": {
        "executor_elapsed_ms": 13311,
        "networked_setup_elapsed_ms": 7946,
        "dependency_install_ms": null,
        "declared_commands_ms": 1388,
        "unclassified_executor_ms": 3977,
        "cpu_ms": null,
        "peak_rss_bytes": null,
        "measurement_status": "partial"
      },
      "resource_envelope": {
        "cpus": 2,
        "memory_mb": 4096,
        "pids": 512,
        "wall_clock_seconds_per_command": 1800,
        "output_bytes_per_stream": 2000000
      }
    },
    "work_scope": {
      "files_changed": 2,
      "changed_lines": 16,
      "production_files": 1,
      "test_files": 1,
      "checks_declared": 1,
      "checks_not_run": [
        "Full npm test suite"
      ]
    },
    "costs": {
      "status": "partial",
      "currency": null,
      "lines": [
        {
          "component": "maintainer_payment",
          "measurement_class": "observed_quantity_unpriced",
          "quantity": "0",
          "unit": "external_transfer",
          "unit_rate": null,
          "amount": null,
          "currency": null,
          "source_refs": [
            {
              "artifact": "bundle/mission.json",
              "artifact_sha256": "sha256:edfbff754edfa099bb3828a85cda7826c5213e5774730920392d8785e921db1b",
              "json_pointer": "/payment/maintainer_payment"
            }
          ],
          "rate_card_digest": null,
          "allocation_method": null,
          "finality": "final",
          "visibility": "public"
        }
      ],
      "known_direct_cost": null,
      "allocated_shared_cost": null,
      "human_standard_cost": null,
      "total_economic_cost": null,
      "missing_components": [
        "model_inference",
        "actual_host_compute",
        "human_review",
        "shared_tooling"
      ]
    },
    "outcome": {
      "technical_checks_passed": true,
      "pr_opened": true,
      "merged": false,
      "merged_pr_head_matches_recorded_commit": null,
      "time_to_close_ms": null,
      "released": null,
      "deployed": null,
      "business_result_observed": null
    },
    "completeness": {
      "task_identity": "complete",
      "technical_execution": "complete",
      "attempt_lineage": "complete",
      "usage": "partial",
      "cost": "unpriced",
      "external_outcome": "partial",
      "business_value": "not_observed"
    },
    "provenance": {
      "spec_sha256": "sha256:e4b67699ef6d3e977761f6722f236dab356fcc3723f17c252d7cc4fda8a5270f",
      "qualification_evidence_sha256": "sha256:159d87a605c9de6a080383fd1e9391b7ee9c1496235cb7854d79315fdf6bd522",
      "issue_snapshot_sha256": "sha256:ecffb779e45bd9ef2905a4ecf78a1b99a962f802544c15e80b97cf268587d726"
    }
  }
}
